"Social media platforms are double-edged swords in modern society. On one hand, they enable global connection, give marginalized voices a platform, and help spread information quickly. They’ve revolutionized how we communicate, campaign, and create communities across borders. On the other hand, these platforms often amplify misinformation, encourage performative behavior, and can negatively impact mental health through comparison, cyberbullying, and addiction. The algorithms tend to prioritize outrage and sensationalism, shaping public opinion in ways that may not always align with truth or empathy. So, while social media can help society evolve and connect, its unchecked influence can just as easily harm the social fabric.",0.9957446808510638,0.9720238095238103,0.9620253164556963,0.9490990990990987,0.908518518518519,0.8878160919540229,0.8324999999999999,0.9005691497948497,156.34315789473683,0.8155339805825242
"Those in favor of granting AI certain rights argue that as AI systems grow more advanced — potentially reaching levels of self-awareness or autonomous decision-making — they may deserve moral consideration. If an AI can think, feel, or suffer (hypothetically), denying it rights could become ethically questionable, similar to past debates over animal rights. On the other side, opponents argue that AI, no matter how advanced, lacks consciousness and biological life — it's a tool created by humans, not a being. Granting it rights could blur ethical boundaries, undermine human responsibility, and complicate accountability. The debate ultimately hinges on where we draw the line between intelligence and personhood.",0.9878787878787882,0.9634831460674168,0.9542857142857141,0.9455696202531652,0.9057627118644074,0.8360784313725493,0.7744444444444444,0.8851366228812895,125.61230769230772,0.7592592592592593
"Capitalism has both fueled and constrained artistic expression. On one hand, it provides artists with opportunities to earn a living, reach audiences through commercial platforms, and innovate through competition and market demand. Artistic careers, once rare, can now flourish via branding, sponsorships, and digital monetization. However, capitalism can also compromise artistic integrity, pushing creators to prioritize profit over authenticity. Art risks becoming a product tailored to trends rather than a genuine expression of thought or emotion. The result is a tension where art must often navigate between staying true to its soul and surviving in a market-driven world.",0.9842696629213482,0.946835443037975,0.9291891891891895,0.9115942028985496,0.8824489795918364,0.8461111111111109,0.8163265306122449,0.8907646548766243,149.3955555555556,0.8163265306122449
"Orwell’s 1984 explores themes of totalitarianism, surveillance, language manipulation, and individual freedom. At its core, the novel warns about the dangers of an all-powerful state that seeks to control not just actions, but thoughts. The omnipresent “Big Brother” and the Thought Police illustrate the terrifying reach of government over privacy. Newspeak, the fictional language, shows how restricting words can limit the ability to think critically or rebel. The erosion of truth — where facts can be rewritten — speaks to the fragility of reality under authoritarian rule. Ultimately, 1984 is a chilling exploration of how power, if unchecked, can dismantle human dignity and identity.",0.968421052631579,0.909411764705883,0.8870000000000005,0.8640000000000001,0.8116363636363634,0.7786666666666667,0.752,0.8455110571713924,116.48,0.75
"Let’s compare the political systems of the United States and China. The U.S. is a federal democratic republic with a constitution that ensures separation of powers among the executive, legislative, and judicial branches. Citizens elect representatives, and freedom of speech, press, and political participation are constitutionally protected. In contrast, China is a single-party authoritarian state led by the Chinese Communist Party (CCP). While it has a structured government and periodic elections within the party, the CCP maintains control over all branches of power, and political dissent is tightly restricted. While the U.S. system emphasizes pluralism and checks and balances, China’s system prioritizes centralized stability and long-term policy execution over political competition.",0.9539215686274515,0.9076086956521741,0.8878160919540234,0.8707317073170727,0.7999999999999999,0.7329729729729729,0.6749999999999998,0.7920319042011897,72.79442100328177,0.6576576576576577
"Freedom, at its essence, is the ability to act, think, or live without external restraint — but true freedom is more complex than simply doing as one pleases. It includes autonomy over one’s decisions, access to opportunity, and the absence of fear or coercion. However, freedom is always tied to responsibility and the social context we live in; one person’s freedom can infringe upon another’s. There’s also internal freedom — the ability to free oneself from anxiety, past traumas, or societal expectations. So, real freedom might not just be political or external, but a deep inner state of clarity and self-direction.",0.9978260869565218,0.9658536585365862,0.9506493506493505,0.9337962962962951,0.8546153846153844,0.8074074074074074,0.745,0.8508092011073615,109.8569230769231,0.7425742574257426
"Objective truth refers to facts that exist independently of beliefs, feelings, or perceptions — like the boiling point of water or the laws of gravity. In science and mathematics, such truths are often observable and repeatable. But in areas like morality, politics, or personal experience, truth becomes murkier, often shaped by culture, language, or perspective. While some argue that everything is subjective, others hold that at least some truths must be universal. The real challenge lies in distinguishing what is genuinely objective from what only feels true because it aligns with our views or environment.",0.9732558139534886,0.9052631578947372,0.8867605633802828,0.8696969696969694,0.8156521739130437,0.7587301587301588,0.7473684210526316,0.8542833614129925,105.29166666666667,0.7473684210526316
"Time and change are intimately linked — our perception of time often relies on witnessing movement or transformation, like the ticking of a clock, the rising of the sun, or aging. If absolutely nothing changed — no motion, no thought, no decay — could we still measure or even sense time? Some philosophers and physicists argue that without change, time becomes meaningless; it’s only through events unfolding that time takes shape. Others suggest time could still exist as a dimension, even if nothing moves through it. It’s a question that lies at the edge of metaphysics and physics, with no easy answer.",0.9526881720430107,0.89698795180723,0.873333333333334,0.8547945205479452,0.7932075471698117,0.7166666666666668,0.68,0.8197422172880273,87.11673151750972,0.6764705882352942
"The paradox of choice suggests that while having choices is empowering, too many choices can overwhelm us and reduce satisfaction. In modern life, we're bombarded with endless options — from what to eat to how to live — and this abundance, rather than liberating us, often leads to anxiety, decision fatigue, and fear of missing out. The more options we have, the more we worry we’re choosing “wrong,” and the more we second-guess ourselves. Ironically, the pursuit of perfect choice can leave us less content than if we had fewer but clearer paths.",0.9380952380952379,0.8756756756756766,0.8498550724637683,0.8265625,0.7749999999999999,0.7200000000000001,0.6881720430107527,0.8109756930572599,73.2953593194515,0.6881720430107527
"Living a meaningful life doesn’t have a single definition — it’s a deeply personal journey shaped by values, purpose, connection, and growth. For some, meaning comes from relationships, creativity, service, or faith. For others, it lies in exploration, self-discovery, or leaving a legacy. What most meaningful lives share is a sense of alignment — when one’s actions reflect one’s beliefs, and each day feels connected to something larger than just survival or routine. A meaningful life may not always be happy, but it’s rich, reflective, and filled with intention, even amidst challenges.",0.9795180722891564,0.9595890410958909,0.9529411764705891,0.9412698412698409,0.8860465116279068,0.848888888888889,0.8152173913043478,0.8911320908482449,139.40705882352938,0.8152173913043478
"Okay! Imagine you have two magical marbles — one red and one blue — but you don’t know which is which. You give one marble to your friend and keep the other. Even if your friend goes to the moon, the moment you look at your marble and see it’s red, your friend’s marble will instantly become blue — like magic! In quantum entanglement, tiny particles like electrons or photons can become linked like those marbles. No matter how far apart they are, knowing something about one instantly tells you something about the other. It’s like they’re connected by an invisible string that works faster than anything we know.",0.9419999999999997,0.8766666666666678,0.8489411764705892,0.8299999999999997,0.7733333333333337,0.7074285714285715,0.635,0.8145506022253797,57.44676700111483,0.6422018348623854
"A neural network is a system designed to mimic how the human brain processes information. Its core components are neurons (nodes), layers, weights, biases, and activation functions. Neurons are organized into layers: the input layer receives raw data, hidden layers process it, and the output layer delivers the final prediction. Weights determine the importance of inputs, while biases help shift the output of neurons to better fit data patterns. Activation functions decide whether a neuron should “fire” or not, introducing non-linearity so the network can learn complex patterns. Together, these parts allow a network to learn from data through training.",0.9626373626373622,0.8919753086419762,0.8610526315789481,0.8319248826291076,0.7435294117647058,0.678974358974359,0.65,0.7996984558577802,68.91727872525831,0.65
"DNA transcription is the first step in turning genetic instructions into proteins. It begins when an enzyme called RNA polymerase binds to a specific section of DNA (the promoter region). It unwinds the DNA and reads one strand, building a matching strand of messenger RNA (mRNA) by pairing DNA bases with their RNA complements (A with U, T with A, C with G, and G with C). Once the mRNA strand is complete, it detaches and leaves the nucleus, carrying the genetic code to the ribosome. There, it will be translated into a protein during the next stage — called translation.",0.9184782608695656,0.8384146341463414,0.805194805194805,0.7740740740740749,0.6915384615384619,0.637037037037037,0.615,0.7651132723035011,59.363020420813385,0.6138613861386139
"Blockchain ensures security through decentralization, cryptography, and consensus mechanisms. Each block in the chain contains a list of transactions, a timestamp, and a cryptographic hash of the previous block. This means if someone tries to alter a block, the entire chain after it becomes invalid. Because the blockchain is distributed across many computers (nodes), no single entity controls it. To validate transactions, the network uses consensus algorithms like Proof of Work or Proof of Stake, which require agreement among nodes before a new block is added. This combination of encryption and transparency makes blockchain highly resistant to tampering.",0.9662921348314605,0.9113924050632913,0.8891891891891899,0.8729468599033805,0.8232653061224491,0.741111111111111,0.7040816326530612,0.8269911767479996,98.0,0.7040816326530612
"TCP (Transmission Control Protocol) and UDP (User Datagram Protocol) are two ways computers send data over the internet, but they work differently. TCP is like sending a registered letter — it makes sure every piece of data arrives correctly and in order, and if something’s missing, it tries again. It’s reliable, but slower. UDP is more like throwing a bunch of postcards — it's fast, but doesn't check if everything arrives or if it's in the right order. That’s why TCP is used for things like web browsing or file downloads, and UDP is used for video streaming or online games, where speed matters more than perfection.",0.9826530612244899,0.9392045454545457,0.9209638554216878,0.908119658119657,0.8148275862068969,0.7224242424242425,0.68625,0.8475047595568798,77.44530327268377,0.6822429906542056
"Early signs of diabetes can be subtle and often go unnoticed. Common symptoms include increased thirst and frequent urination, as the body tries to flush out excess sugar through the urine. People may also experience unexplained weight loss, fatigue, blurred vision, slow-healing wounds, and frequent infections. In Type 2 diabetes, symptoms may develop gradually over time, making early detection tricky. Some may notice tingling or numbness in the hands and feet due to nerve damage. Recognizing these early signs and getting a blood sugar test can help with timely diagnosis and better management.",0.9976190476190476,0.9709459459459466,0.958260869565218,0.9442708333333322,0.8909090909090905,0.8336842105263156,0.7956989247311828,0.883586616740563,127.45894736842104,0.7956989247311828
"Flu and COVID-19 share many symptoms, including fever, cough, body aches, fatigue, sore throat, and congestion. However, COVID-19 often includes additional signs such as loss of taste or smell, which is less common with the flu. COVID-19 can also cause breathing difficulties and chest pain in more severe cases, and symptoms may last longer or appear more gradually. Both illnesses are caused by different viruses — influenza viruses for the flu and SARS-CoV-2 for COVID-19 — and while both can lead to serious complications, COVID-19 has been associated with more widespread systemic effects, including blood clots and long-term symptoms.",0.9777777777777777,0.9356250000000003,0.9162666666666672,0.898095238095238,0.8195999999999997,0.7498666666666665,0.7070707070707071,0.8318811016610623,86.86764705882354,0.7070707070707071
"Chronic stress weakens the immune system by consistently elevating cortisol levels — a hormone that, in excess, suppresses immune function. This hormonal imbalance reduces the body's ability to produce infection-fighting white blood cells and inflammatory responses, making individuals more susceptible to colds, infections, and slower wound healing. Long-term stress can also trigger inflammation, which contributes to a range of health problems including autoimmune diseases, cardiovascular issues, and digestive disorders. In short, while acute stress can temporarily boost alertness, chronic stress undermines the immune system’s resilience over time.",0.9948717948717951,0.9742647058823534,0.9644444444444451,0.9505747126436781,0.9121052631578946,0.8625641025641027,0.8275862068965517,0.8988766316470447,141.28799999999998,0.8275862068965517
"The gut microbiome — a community of trillions of bacteria, viruses, and fungi living in our digestive tract — plays a crucial role in maintaining overall health. It helps digest food, produce essential vitamins (like B and K), regulate the immune system, and protect against harmful pathogens. A balanced microbiome also influences brain health through the gut-brain axis, affecting mood and cognitive function. Disruptions in this microbial balance (dysbiosis) have been linked to conditions like obesity, diabetes, depression, and autoimmune diseases. Eating fiber-rich, diverse diets and avoiding unnecessary antibiotics support a healthy gut microbiome.",0.9823529411764708,0.9613333333333338,0.9497142857142862,0.9364102564102563,0.8799999999999996,0.842,0.7872340425531915,0.8742943662978298,123.70400000000002,0.7872340425531915
"Intermittent fasting (IF), which involves cycling between periods of eating and fasting, offers several health benefits. Pros include improved insulin sensitivity, potential weight loss, better metabolic health, and possibly enhanced brain function and cellular repair. Some people also report increased mental clarity and reduced inflammation. However, IF isn't for everyone. Cons include hunger, fatigue, irritability, and potential nutrient deficiencies if not planned well. It may also interfere with social meals or exacerbate disordered eating patterns in vulnerable individuals. As with any diet, sustainability and individual compatibility are key to its effectiveness.",0.9902439024390246,0.9534722222222225,0.9397014925373143,0.9301075268817198,0.8857142857142852,0.8533333333333335,0.8351648351648352,0.9045587386432371,154.5786666666667,0.8351648351648352
"Vaccines work by training the immune system to recognize and respond to pathogens without causing illness. When a vaccine is introduced, it contains either a weakened or inactivated form of the pathogen, or a piece of it (like a protein or mRNA). This triggers immune cells — especially antigen-presenting cells — to capture and present the invader to T-cells and B-cells. B-cells then produce antibodies, while T-cells help destroy infected cells. Memory cells are also formed, so if the actual pathogen enters the body later, the immune system can launch a faster, stronger response.",0.9094117647058821,0.8513333333333332,0.8297142857142862,0.8066666666666665,0.7480000000000001,0.692,0.6702127659574468,0.8041676654230169,65.96704447862894,0.6702127659574468
"To reduce high blood pressure, several lifestyle changes can be highly effective. Regular physical activity — even 30 minutes of walking a day — strengthens the heart and lowers pressure. A balanced diet rich in fruits, vegetables, whole grains, and low in salt (DASH diet) can help regulate blood pressure. Reducing alcohol intake, quitting smoking, managing stress through relaxation techniques, and getting quality sleep are also essential. Weight loss, even a small amount, can significantly impact blood pressure levels. Consistency and gradual habit change are key for long-term control.",0.9925,0.9628571428571427,0.9415384615384617,0.9222222222222223,0.8614999999999998,0.8053333333333331,0.7752808988764045,0.8696514126242113,110.894,0.7752808988764045
"Gene editing in humans, especially using tools like CRISPR, raises complex ethical issues. On one hand, it holds immense promise for eliminating genetic diseases, enhancing quality of life, and advancing medicine. However, concerns arise over unintended consequences, genetic inequality, and the potential for “designer babies,” where traits like intelligence or appearance could be modified for non-medical reasons. There’s also a lack of long-term data on safety and heritability. Ethical frameworks stress the importance of informed consent, global regulation, and distinguishing therapeutic use from enhancement to ensure gene editing serves humanity rather than divides it.",1.0,0.9746666666666671,0.9622857142857149,0.9502564102564097,0.9053333333333328,0.8600000000000001,0.8297872340425532,0.912870827063181,154.63,0.8297872340425532
"Palliative care is a type of medical care focused on relieving symptoms and improving quality of life for patients with serious illnesses, regardless of the stage or whether they are pursuing curative treatment. It can be given alongside other treatments. Hospice care, on the other hand, is a specific type of palliative care for patients nearing the end of life — typically with a prognosis of six months or less — and focuses entirely on comfort rather than cure. While both aim to ease suffering, hospice care begins only when curative options are no longer being pursued.",0.977272727272727,0.9192307692307691,0.8986301369863022,0.8794117647058821,0.776666666666667,0.7049275362318841,0.6494845360824743,0.803102657187435,72.7039411206078,0.6494845360824743
"Rural populations often face significant barriers to mental health care, including a shortage of mental health professionals, long travel distances, and limited access to facilities. Stigma around mental illness can be more pronounced in close-knit rural communities, discouraging people from seeking help. Financial barriers, lack of insurance, and unreliable internet access also make teletherapy less accessible. These challenges can lead to untreated mental health conditions, increased suicide rates, and a cycle of poor outcomes. Addressing these issues requires investment in telehealth infrastructure, training local providers, and community-based awareness programs.",0.9925,0.9778571428571429,0.9692307692307695,0.9594444444444444,0.8925000000000004,0.8044444444444442,0.7865168539325843,0.8777144138100331,116.7305263157895,0.7865168539325843
"Soil erosion occurs when wind, water, or human activity removes the top layer of soil, which is vital for plant growth. Major causes include deforestation, overgrazing, poor agricultural practices, and construction activities that disturb the land. Without vegetation to hold soil in place, rain and wind can easily wash or blow it away. Preventing soil erosion involves practices like planting cover crops, maintaining vegetation buffers, practicing contour plowing, building terraces on slopes, and reducing over-tillage. Conservation farming and reforestation also play key roles in stabilizing soil and preserving long-term land productivity.",0.9902439024390248,0.9701388888888902,0.9635820895522395,0.9478494623655901,0.882380952380952,0.84,0.7912087912087912,0.8779530254927381,122.03578947368419,0.7912087912087912
"Precision agriculture uses technology — such as GPS, sensors, drones, and data analytics — to optimize every aspect of crop production. By analyzing real-time data on soil conditions, moisture levels, crop health, and weather patterns, farmers can apply water, fertilizers, and pesticides only where and when needed. This minimizes waste, reduces environmental impact, and improves yields. Precision agriculture transforms farming from a one-size-fits-all approach to a data-driven, site-specific strategy that helps conserve resources while increasing efficiency and sustainability.",0.9768115942028982,0.9381355932203393,0.9237037037037046,0.9129251700680265,0.8993103448275864,0.8633333333333334,0.8461538461538461,0.8989203434769394,141.96,0.8461538461538461
"Crop rotation involves growing different types of crops in the same field across different seasons or years. This practice naturally replenishes soil nutrients, as different crops have varying nutrient demands. For example, legumes like beans and peas fix nitrogen in the soil, which benefits the next crop. Crop rotation also disrupts pest and disease cycles and improves soil structure by alternating deep- and shallow-rooted plants. Over time, it leads to healthier, more fertile soil and reduces the need for chemical fertilizers and pesticides.",0.9554054054054049,0.9085937499999999,0.8800000000000008,0.8635802469135805,0.8094117647058825,0.7688888888888888,0.7469879518072289,0.823606192232597,91.85333333333332,0.7469879518072289
"Traditional farming involves growing crops in soil, relying on natural weather patterns, and often requiring large tracts of land. It is more vulnerable to pests, droughts, and soil-related issues. Hydroponic farming, in contrast, grows plants in a nutrient-rich water solution, often in controlled environments like greenhouses. It uses less water, requires no soil, and enables vertical farming in urban areas. While traditional farming is land-intensive and weather-dependent, hydroponics offers greater efficiency and space-saving potential but requires significant investment and technical expertise.",0.9708333333333332,0.932258064516129,0.9164912280701765,0.8929487179487178,0.8093750000000003,0.758095238095238,0.7407407407407407,0.8242239300783615,87.48,0.7407407407407407
"Monoculture — the practice of growing a single crop over a large area — significantly reduces biodiversity. It creates an environment where pests and diseases can thrive, leading to increased pesticide use. Without plant diversity, beneficial insects, soil microbes, and wildlife lose their habitats and food sources. This disrupts the ecological balance and weakens the resilience of farming systems. Over time, monoculture can also deplete specific soil nutrients and increase vulnerability to climate and market changes, threatening long-term agricultural sustainability.",0.9661971830985915,0.9368852459016398,0.9271428571428582,0.9176470588235288,0.8741935483870967,0.8022222222222224,0.7875,0.8644216859090269,105.41176470588236,0.7875
"AI can transform agriculture by analyzing vast datasets to make real-time decisions that improve crop productivity. Through machine learning, AI can predict weather patterns, soil conditions, and pest outbreaks, allowing farmers to take timely action. AI-powered drones and cameras monitor crop health, while smart irrigation systems ensure precise water usage. AI also helps in automating machinery and streamlining supply chains. By offering insights at both the micro (plant) and macro (farm) levels, AI enables more accurate, efficient, and sustainable farming practices.",0.9972222222222223,0.9790322580645164,0.9670175438596497,0.954487179487179,0.9212500000000005,0.8799999999999999,0.8518518518518519,0.9031600158709875,153.09,0.8518518518518519
